{
  "$schema": "https://json-schema.org/draft/2020-12/schema",
  "title": "Tasktra transition approval v3",
  "type": "object",
  "additionalProperties": false,
  "required": ["kind", "version", "approval_id", "goal_id", "work_unit_id", "action", "effect", "scope", "resource_scope", "envelope_sha256", "decision", "approver", "performer_id", "authority_clause", "evidence", "provenance", "valid_until", "revoked_at"],
  "properties": {
    "kind": {"const": "tasktra.transition-approval"}, "version": {"const": 3},
    "approval_id": {"$ref": "#/$defs/id"}, "goal_id": {"$ref": "#/$defs/id"},
    "work_unit_id": {"type": ["string", "null"], "minLength": 1, "maxLength": 64, "pattern": "^[a-z][a-z0-9]*(?:-[a-z0-9]+)*$"},
    "action": {"$ref": "#/$defs/id"}, "effect": {"enum": ["read-only", "local-reversible-write", "repository-history", "remote-mutation", "external-communication", "deployment", "merge", "destructive"]},
    "scope": {"$ref": "#/$defs/scope"}, "resource_scope": {"oneOf": [{"type": "null"}, {"$ref": "#/$defs/resourceScope"}]},
    "envelope_sha256": {"type": "string", "pattern": "^[0-9a-f]{64}$"}, "decision": {"enum": ["approved", "rejected", "needs_human_review"]},
    "approver": {"type": "object", "additionalProperties": false, "required": ["kind", "id"], "properties": {"kind": {"const": "human"}, "id": {"$ref": "#/$defs/id"}}},
    "performer_id": {"$ref": "#/$defs/id"}, "authority_clause": {"$ref": "#/$defs/text"},
    "evidence": {"type": "array", "maxItems": 64, "items": {"type": "object", "additionalProperties": false, "required": ["kind", "id", "sha256"], "properties": {"kind": {"enum": ["acceptance-evidence", "workflow-evidence", "checkpoint-evidence"]}, "id": {"$ref": "#/$defs/id"}, "sha256": {"type": "string", "pattern": "^[0-9a-f]{64}$"}}}},
    "provenance": {"type": "object", "additionalProperties": false, "required": ["kind", "attester_id", "subject_sha256", "attested_at"], "properties": {"kind": {"const": "local-human-ceremony"}, "attester_id": {"$ref": "#/$defs/id"}, "subject_sha256": {"type": "string", "pattern": "^[0-9a-f]{64}$"}, "attested_at": {"type": "string", "minLength": 1, "maxLength": 64}}},
    "valid_until": {"type": ["string", "null"], "maxLength": 64}, "revoked_at": {"type": ["string", "null"], "maxLength": 64}
  },
  "$defs": {
    "id": {"type": "string", "minLength": 1, "maxLength": 64, "pattern": "^[a-z][a-z0-9]*(?:-[a-z0-9]+)*$"}, "text": {"type": "string", "minLength": 1, "maxLength": 500}, "path": {"type": "string", "minLength": 1, "maxLength": 240},
    "scope": {"type": "object", "additionalProperties": false, "required": ["paths", "exclusions"], "properties": {"paths": {"type": "array", "minItems": 1, "maxItems": 128, "items": {"$ref": "#/$defs/path"}}, "exclusions": {"type": "array", "maxItems": 128, "items": {"$ref": "#/$defs/path"}}}},
    "resourceScope": {"type": "object", "additionalProperties": false, "required": ["provider", "host", "container", "resource_kind", "resource", "ref"], "properties": {"provider": {"$ref": "#/$defs/resourceText"}, "host": {"$ref": "#/$defs/resourceText"}, "container": {"$ref": "#/$defs/resourceText"}, "resource_kind": {"$ref": "#/$defs/resourceText"}, "resource": {"oneOf": [{"type": "null"}, {"$ref": "#/$defs/resourceText"}]}, "ref": {"oneOf": [{"type": "null"}, {"$ref": "#/$defs/resourceText"}]}}}, "resourceText": {"type": "string", "minLength": 1, "maxLength": 255}
  }
}
