{
  "kind": "tasktra.transition-approval", "version": 3,
  "goal_id": "tasktra-publication", "scope": {"paths": ["."], "exclusions": [".tasktra/runtime", ".tasktra/preview"]},
  "envelope_sha256": "d83e9cb7e604b02c4c53208258ea0ab05ad2bca98389c86bc621458c68f6c4d6",
  "decision": "approved", "approver": {"kind": "human", "id": "matt"}, "performer_id": "codex-coordinator",
  "authority_clause": "The human explicitly authorized making mattazz/Tasktra public after a security review and approved the bounded sanitation, guarded push, and visibility change.",
  "evidence": [], "valid_until": "2026-09-21T08:00:00Z", "revoked_at": null,
  "approval_id": "tasktra-publication-visibility", "work_unit_id": "publish-tasktra", "action": "github-repo-visibility", "effect": "remote-mutation",
  "resource_scope": {"provider": "github", "host": "github.com", "container": "mattazz/Tasktra", "resource_kind": "repository", "resource": null, "ref": null},
  "provenance": {"kind": "local-human-ceremony", "attester_id": "matt", "subject_sha256": "c609ff12380b8039a814058389aa8f533f171ead7b4d052ace353573b3fa0eec", "attested_at": "2026-09-21T05:26:39Z"}
}
